{
  "query_id": "diq-db5889b56cbf",
  "tenant_id": "validation-tokyo-2026",
  "question": "Should a solo technical founder pursue an AI startup opportunity in Tokyo under a limited budget?",
  "constraints": {
    "location": "Tokyo Japan",
    "founderType": "solo technical founder",
    "budget": "limited",
    "timeframe": "2026"
  },
  "similar_decisions": [
    {
      "model_id": "dm-fa6ae2f65ea9",
      "decision_id": "da-e2ea1ca58a04",
      "question": "Which AI startup opportunity has the highest probability of success for a solo founder in Tokyo?",
      "decision_domain": "startup-opportunity:tokyo-japan",
      "overlap_score": 1.063,
      "evidence_refs": [
        "live-github-0",
        "live-github-1",
        "live-github-2",
        "live-github-3",
        "live-github-4",
        "live-github-5",
        "live-github-6",
        "live-github-7"
      ],
      "knowledge_ref": "kn-56b36b0c95105b942d37797381e93794@1.0.0",
      "approval_ref": "ha-c0e6b4d0ea4d"
    }
  ],
  "dna_signals": [
    {
      "signal_type": "decision_pattern",
      "description": "Chosen option pattern: opt-pursue-build — Create Tokyo AI startup decision knowledge recording a build-now path versus employment baseline.",
      "ref": "pat-chosen-opt-pursue-build"
    },
    {
      "signal_type": "preference",
      "description": "actor_id=founder (freq 1)",
      "ref": "sig-5bcd1317dc19"
    },
    {
      "signal_type": "preference",
      "description": "budget=limited (freq 1)",
      "ref": "sig-a0e23ecb95c5"
    },
    {
      "signal_type": "preference",
      "description": "founderType=solo technical founder (freq 1)",
      "ref": "sig-3b0e1917129e"
    },
    {
      "signal_type": "preference",
      "description": "goal=find billion-dollar potential opportunity (freq 1)",
      "ref": "sig-ab7d25dc6bc6"
    },
    {
      "signal_type": "preference",
      "description": "location=Tokyo Japan (freq 1)",
      "ref": "sig-aba16e38888f"
    },
    {
      "signal_type": "preference",
      "description": "timeframe=2026 (freq 1)",
      "ref": "sig-3b0d4f40d153"
    },
    {
      "signal_type": "constraint",
      "description": "budget observed: limited",
      "ref": "cpat-budget"
    },
    {
      "signal_type": "constraint",
      "description": "founderType observed: solo technical founder",
      "ref": "cpat-founderType"
    },
    {
      "signal_type": "constraint",
      "description": "location observed: Tokyo Japan",
      "ref": "cpat-location"
    },
    {
      "signal_type": "constraint",
      "description": "timeframe observed: 2026",
      "ref": "cpat-timeframe"
    },
    {
      "signal_type": "risk",
      "description": "capital_constrained",
      "ref": "risk-cb1ca7189008"
    },
    {
      "signal_type": "risk",
      "description": "solo_founder_capacity",
      "ref": "risk-cb1ca7189008"
    },
    {
      "signal_type": "risk",
      "description": "time_bounded:2026",
      "ref": "risk-cb1ca7189008"
    }
  ],
  "evidence_refs": [
    "live-github-0",
    "live-github-1",
    "live-github-2",
    "live-github-3",
    "live-github-4",
    "live-github-5",
    "live-github-6",
    "live-github-7"
  ],
  "dna_ref": "dna-b7dcbded1771",
  "human_approval_required": true,
  "automatic_decision": false,
  "recommendation": false,
  "created_at": "2026-07-27T11:37:46.801Z",
  "version": "0.1.0"
}
